{
  "graphVersion": "aura-graph/v2.0@680FD8D8F2142E92DE5A629B60D9C1DE160CCC57A0F7DDDDC872CDC4ACDAB9A8",
  "node": "G01",
  "lane": "governance",
  "stage": "governed-start",
  "job": "Create the canonical Graph v2 registry, execution-manifest schema, and deterministic authority validator.",
  "inputs": [
    {
      "name": "approved-graph",
      "version": "2.0",
      "hash": "680FD8D8F2142E92DE5A629B60D9C1DE160CCC57A0F7DDDDC872CDC4ACDAB9A8"
    },
    {
      "name": "founder-approval",
      "version": "2026-08-24",
      "hash": "git:e031a83"
    }
  ],
  "outputs": [
    {
      "name": "current-graph-registry",
      "acceptanceSchema": "AuraCurrentGraphV1",
      "path": "docs/plans/registry/current-graph.json"
    },
    {
      "name": "execution-node-schema",
      "acceptanceSchema": "JSON-Schema-2020-12",
      "path": "docs/plans/execution/schema/aura-execution-node.schema.json"
    },
    {
      "name": "authority-verifier",
      "acceptanceSchema": "deterministic-local-gate",
      "path": "app/scripts/prove-graph-v2.mjs"
    }
  ],
  "depends": ["G00", "approval:e031a83"],
  "reject": [
    "approved graph commit or Git-blob SHA-256 does not match the approval record",
    "registry points to an unapproved or mutable graph",
    "manifest omits a required field or names an unknown graph node",
    "working tree contains an overlapping unowned write set",
    "candidate work touches a protected 3D or public-site visual path"
  ],
  "writeSet": [
    "docs/plans/2026-08-24-canvas-first-guided-studio-plan.md",
    "docs/plans/execution/v2/G01-canonical-graph-registry.json",
    "docs/plans/registry/current-graph.json",
    "app/scripts/prove-graph-v2.mjs",
    "app/scripts/prove-graph-v2.test.mjs"
  ],
  "freezeClass": "none",
  "owner": "primary-agent",
  "verifier": "independent-fresh-context",
  "sideEffects": "local",
  "externalGates": [],
  "verification": [
    "node app/scripts/prove-graph-v2.mjs",
    "node --test scripts/prove-graph-v2.test.mjs",
    "npm run typecheck",
    "git diff --name-only e031a83...HEAD"
  ],
  "repair": {
    "maxLoops": 1,
    "boundary": "G01 writeSet only"
  },
  "evidence": {
    "candidateCommit": "16552455d31190722f80718566c451fd70f5ac9d",
    "recordedAt": "2026-08-24",
    "authorityGate": "pass",
    "focusedTests": "6/6",
    "typecheck": "pass",
    "jsonContracts": "pass",
    "protectedPathChanges": 0,
    "repairLoop": "1/1 — canonical approval path and parsed approval body",
    "manifestReconciliation": "exact 5/5 candidate paths; removed 3 paths committed before candidate base",
    "priorIndependentFinding": "write-set equality corrected after 5cbb015",
    "independentReverification": "pass at b81553a; 5/5 paths, 6/6 tests, typecheck exit 0, zero protected paths",
    "verifierVerdict": "pass"
  },
  "status": "verified"
}
