{
  "graphVersion": "aura-graph/v2.0@680FD8D8F2142E92DE5A629B60D9C1DE160CCC57A0F7DDDDC872CDC4ACDAB9A8",
  "node": "IP03",
  "lane": "image-to-plan",
  "stage": "provider-neutral-adapter",
  "job": "Create one fail-closed provider-neutral image-to-DesignIntent task contract and deterministic fake with shared typed request, response, error, cancellation, timeout, and integer-micro cost surfaces, without network, money, secrets, persistence, project mutation, or provider-specific behavior.",
  "inputs": [
    {
      "name": "IP02-verified-design-intent-schema",
      "version": "f9f7c0c",
      "hash": "git:f9f7c0c24d55aa1d3366b1e6238160b79154d266"
    },
    {
      "name": "approved-provider-neutral-adapter-contract",
      "version": "2.0",
      "hash": "git:f7616886f9f8a171c847ef5eb49e932246ff989b"
    },
    {
      "name": "IP03-implementation-plan",
      "version": "2026-08-29",
      "hash": "git:8d24ad3676b104973baea37805148b9d32afefa0"
    }
  ],
  "outputs": [
    {
      "name": "provider-neutral-design-intent-task-boundary",
      "acceptanceSchema": "AuraDesignIntentAdapterV1",
      "path": "app/lib/ai/designIntentAdapter.ts"
    },
    {
      "name": "deterministic-adapter-contract-proof",
      "acceptanceSchema": "Playwright deterministic hostile-boundary proof",
      "path": "app/tests-ip03/design-intent-adapter.contract.ts"
    }
  ],
  "depends": [
    "IP02:verified"
  ],
  "reject": [
    "IP02 is not independently verified",
    "fixture and hosted-shaped execution use different task, response, error, cancellation, timeout, or cost interfaces",
    "adapter output is returned without strict promotion through parseDesignIntent",
    "unknown, malformed, geometry-bearing, accessor, proxy, aliased, or mutable adapter output or receipt passes validation",
    "request metadata, bytes, response, fixture, intent, or receipt remain aliased to caller- or adapter-owned mutable data",
    "timeout or caller cancellation cannot abort and settle independently of a hung adapter",
    "a raw error, cause, message, stack, URL, header, body, credential, provider name, or private detail escapes normalization",
    "cost is negative, floating point, unsafe, non-USD, hidden, or combined with an Aura user fee",
    "request ID, adapter ID/version, model ID, provider request ID, source fingerprint, token count, timeout, MIME signature, or encoded byte length is absent, inconsistent, unsafe, or unbounded",
    "the deterministic fake reads time, randomness, storage, network, wallet, payment, project, geometry, or another external state",
    "an OpenRouter or provider-specific SDK, name, secret, live call, model choice, fee, budget, credit, payment, persistence, project mutation, or autonomous geometry enters IP03",
    "an undeclared path changes or the complete candidate write set differs from this manifest",
    "a website 3D, rendering, animation, engine, scene, public visual, model, texture, shader, camera, lighting, motion, or quality-tier path changes"
  ],
  "writeSet": [
    "docs/plans/2026-08-29-ip03-provider-neutral-adapter-plan.md",
    "docs/plans/execution/v2/IP03-provider-neutral-adapter.json",
    "app/lib/ai/designIntentAdapter.ts",
    "app/tests-ip03/design-intent-adapter.contract.ts",
    "app/playwright.ip03.config.ts"
  ],
  "freezeClass": "none",
  "owner": "primary-agent",
  "verifier": "independent-fresh-context",
  "sideEffects": "none",
  "externalGates": [],
  "verification": [
    "npm run typecheck",
    "npx playwright test --config=playwright.ip03.config.ts",
    "npm test",
    "npm run test:graph-v2",
    "npm run test:graph-position",
    "fixture: fake and hosted-shaped adapters use the exact same public method and boundary",
    "fixture: request metadata and byte snapshots are detached before adapter invocation",
    "fixture: deterministic fake repeats exactly without clock, randomness, network, storage, secrets, money, or project access",
    "fixture: malformed, hostile, unknown-key, geometry-bearing, aliased, or mutable output and receipts fail closed",
    "fixture: caller cancellation and timeout are distinct, abort adapter work, and settle a hung task",
    "fixture: raw thrown values and provider-private detail normalize to bounded safe errors",
    "fixture: integer USD-micro cost and safe token/identifier facts survive a frozen detached round trip",
    "static proof: the module has no provider SDK, fetch, XMLHttpRequest, WebSocket, wallet, payment, persistence, project, geometry, 3D, renderer, or animation dependency",
    "git diff --name-only <IP03-base>...<IP03-candidate>"
  ],
  "repair": {
    "maxLoops": 1,
    "boundary": "IP03 writeSet only"
  },
  "evidence": {
    "startedFrom": "04b7f8f196c8eec5e93ff6b751264fb46feee87c",
    "dependencyGate": "IP02 independently verified at f9f7c0c24d55aa1d3366b1e6238160b79154d266",
    "planCommit": "8d24ad3676b104973baea37805148b9d32afefa0",
    "readyManifestCommit": "7e3fb5e1f3ae2811a670f7ce2a215c7452b6ba41",
    "readinessReconciliation": "Graph v2 authority passed 25/25 before and after the committed ready manifest; IP02 is committed verified; the worktree was clean; external gates are empty; declared protected paths are zero. The generic gate did not surface UX08's live ownership of shared count/evidence paths; completed-candidate G05 did, and the one bounded repair removes those paths before closure.",
    "existingSurfaceAudit": "IP01 provides the provider-free safe image-intake receipt and IP02 provides the strict DesignIntent parser. No provider-neutral adapter, deterministic model fake, normalized execution receipt, task cancellation boundary, or provider-cost contract exists. IP03 will not instantiate OpenRouter or a live model.",
    "writeOwnership": "After the bounded repair, no ready, active, verification-pending, or integration-pending manifest owns an IP03 path. The dedicated IP03 test/config replaces shared package, count, README, and submission edits still owned by verification-pending UX08.",
    "protectedPathChanges": 0,
    "githubSync": "pending: GitHub OAuth workflow scope refresh is in progress so the preserved source-ci workflow can remain intact",
    "repairLoop": {
      "used": 1,
      "maximum": 1,
      "initialCandidate": "4b4ad28d11f07b6c011fd940b375841575ba0fe1",
      "initialVerdict": "FAIL: G05 identified overlapping live ownership because UX08 remains verification-pending on the shared package-count evidence surfaces.",
      "resolution": "Move the 18 IP03 proofs behind a dedicated checked-in Playwright config and restore every UX08-owned shared file exactly, narrowing IP03 to five disjoint declared paths."
    },
    "verificationClosure": {
      "verdict": "verification-pending",
      "activationCommit": "e7a5a723eed84f50da14c66f59557378c1b080cc",
      "candidateCommit": "cb2aa08fae65f38dcc4ab27824408c1a666523bc",
      "lineageBase": "04b7f8f196c8eec5e93ff6b751264fb46feee87c",
      "writeSetCheck": {
        "declared": 5,
        "changed": 5,
        "delta": 0,
        "protectedPathChanges": 0,
        "overlappingOwners": []
      },
      "positionReceipt": "G05 explicit preflight passed authority, IP02 dependency, exact 5/5 writes, clean worktree, complete evidence, decision history, and movement remain at repaired candidate cb2aa08fae65f38dcc4ab27824408c1a666523bc.",
      "gateReceipts": {
        "typecheck": "pass",
        "focusedAdapter": "18/18 dedicated IP03 contract proofs passed in 1.6s without a server or external service",
        "deterministic": "737 declared; 733 passed and 4 intentional served-only skips in 47.0s; shared UX08-owned count surfaces remained byte-identical to the node base",
        "graphV2": "25/25 passed; authority pass; manifest errors empty",
        "graphPosition": "14/14 position-check contract tests passed; explicit repaired-candidate preflight passed",
        "diffCheck": "pass"
      },
      "contractEvidence": {
        "sharedBoundary": "Hosted-shaped and deterministic-fake adapters execute through the same typed request, response, error, cancellation, timeout, and integer-USD-micro receipt boundary while retaining honest adapter-kind provenance.",
        "requestIsolation": "Request metadata is strict JSON-like data; image bytes are synchronously snapshotted; MIME signature, intake facts, byte length, source fingerprint, and bounded timeout are checked before adapter invocation.",
        "outputPromotion": "Every raw intent passes the strict IP02 parser, contains the exact requested uploaded-image fingerprint, and is returned detached and deeply frozen with a validated receipt.",
        "hostileBoundary": "Unknown keys, geometry, accessors, custom prototypes, revoked proxies, arbitrary thrown values, private messages, causes, receipt traps, and adapter descriptor traps fail through bounded safe errors without invocation or leakage.",
        "sideEffects": "The module imports only IP01/IP02 contracts and contains no provider SDK, network, secret, wallet, payment, persistence, project, geometry, 3D, renderer, or animation dependency."
      },
      "remainingGate": "independent fresh-context verification"
    }
  },
  "status": "verification-pending"
}
