{
  "graphVersion": "aura-graph/v2.0@680FD8D8F2142E92DE5A629B60D9C1DE160CCC57A0F7DDDDC872CDC4ACDAB9A8",
  "node": "UX03",
  "lane": "guided-studio",
  "stage": "selection-driven-inspector",
  "job": "Project the existing 2D tool and selection state into an explicit contextual inspector without creating a second editor model or a second mutation path.",
  "inputs": [
    {
      "name": "UX02-verified-canvas-first-shell",
      "version": "1",
      "hash": "git:e7a4859b96a5c4815bfc80cce478000bd9087c9c"
    },
    {
      "name": "guided-studio-interaction-design",
      "version": "2026-08-24",
      "hash": "git:f7616886f9f8a171c847ef5eb49e932246ff989b"
    }
  ],
  "outputs": [
    {
      "name": "contextual-inspector-state-contract",
      "acceptanceSchema": "GuidedStudioInspectorStateV1",
      "path": "app/lib/builder/guidedStudio.ts"
    },
    {
      "name": "selection-driven-contextual-inspector",
      "acceptanceSchema": "ContextualInspectorA11yV1",
      "path": "app/components/builder/ContextualInspector.tsx"
    },
    {
      "name": "contextual-inspector-evidence",
      "acceptanceSchema": "Playwright-and-deterministic-proof",
      "path": "app/tests/builder-plans-first.spec.ts"
    }
  ],
  "depends": ["UX02:verified"],
  "reject": [
    "UX02 is not independently verified",
    "the inspector stores project, geometry, history, persistence, or canonical selection state",
    "pointer, keyboard, exact-value, or accepted-AI input gains a separate mutator, validator, history label, hash, or persistence path",
    "invalid exact input is discarded, silently clamped, or detached from the violated constraint",
    "empty, active-tool, single-selection, or invalid-input state is ambiguous to assistive technology",
    "the existing 2D canvas or first-edit controls move below the 1280 by 720 first viewport",
    "a public-site, 3D, renderer, animation, engine, scene, model, texture, shader, camera, lighting, motion, or quality-tier path changes"
  ],
  "writeSet": [
    "docs/plans/execution/v2/UX03-contextual-inspector.json",
    "app/components/builder/BuilderApp.tsx",
    "app/components/builder/ContextualInspector.tsx",
    "app/components/builder/GraphPlanEditor.tsx",
    "app/lib/builder/guidedStudio.ts",
    "app/tests/builder-plans-first.spec.ts",
    "app/tests/gate-coverage.spec.ts",
    "README.md",
    "docs/SUBMISSION.md"
  ],
  "freezeClass": "none",
  "owner": "primary-agent",
  "verifier": "independent-fresh-context",
  "sideEffects": "local",
  "externalGates": [],
  "verification": [
    "npm run typecheck",
    "npm test",
    "npm run test:ui",
    "npx playwright test tests/builder-plans-first.spec.ts --config=playwright.r0.config.ts",
    "npm run test:graph-v2",
    "browser evidence: empty, active-tool, single-selection, and invalid-input inspector states are named and keyboard-readable",
    "browser evidence: 1280x720 canvas and first-edit controls remain visible at scrollY=0",
    "git diff --name-only <UX03-base>...HEAD"
  ],
  "repair": {
    "maxLoops": 1,
    "boundary": "UX03 writeSet only"
  },
  "evidence": {
    "startedFrom": "e7a4859b96a5c4815bfc80cce478000bd9087c9c",
    "dependencyGate": "UX02 verified",
    "readyManifestCommit": "189c3110e2ca8beff050f4cda5b3e76c2cadf161",
    "activeManifestCommit": "f56c958b313a061fffd4600f18504e0c1a04f5e7",
    "candidate": "cff9d6c45f2089c25b1d1846ce029403373f25c6",
    "writeSetCheck": {
      "declared": 9,
      "changed": 9,
      "delta": 0,
      "candidateGuardErrors": []
    },
    "browserEvidence": {
      "toolState": "Guided Rooms names the active Shape tool; Guided Shell suppresses preserved plan selection or invalid state and names the active Shell tools instead",
      "selectionState": "a real graph wall exposes identity, length, thickness, placement, and the canonical exact-value action",
      "invalidState": "raw -1 remains editable beside the violated positive-length constraint, is hidden while Shell is active, and is restored when Rooms becomes active again",
      "documentIdentity": "the active design hash is unchanged by selection and the refused exact value",
      "firstViewport1280x720": "editable plan and first-edit tools visible at scrollY=0"
    },
    "gateReceipts": {
      "typecheck": "pass at cff9d6c45f2089c25b1d1846ce029403373f25c6",
      "deterministic": "677 passed, 2 intentionally skipped served-only proofs; 679 declared at cff9d6c45f2089c25b1d1846ce029403373f25c6",
      "servedUi": "135/135 passed in 18.8m against the rebuilt production export at cff9d6c45f2089c25b1d1846ce029403373f25c6",
      "focusedServed": "11/11 passed in 40.6s at cff9d6c45f2089c25b1d1846ce029403373f25c6 against the fresh export produced by the preceding full UI gate; the served regression covers selection and invalid state across Rooms-to-Shell-to-Rooms transitions",
      "graphV2": "14/14 passed; authority pass; zero manifest errors at cff9d6c45f2089c25b1d1846ce029403373f25c6"
    },
    "repair": "The independent review proved that the mounted-but-hidden GraphPlanEditor kept projecting a Rooms wall selection after Guided Shell became active. The single permitted repair preserves that plan state but projects it only while the graph plan surface is active; Shell shows its own tool state. The served regression covers both stale selection and stale invalid input, then proves both states restore when Rooms becomes active again.",
    "independentVerdict": "FAIL at closure c312b780d777a6aefe84d3a48e729e06d2103f63: a wall selection from Guided Rooms remained projected after Guided Shell hid the 2D plan surface",
    "repairLoop": "1 of 1 completed at cff9d6c45f2089c25b1d1846ce029403373f25c6; pending independent re-verification",
    "protectedPathChanges": 0
  },
  "status": "verification-pending"
}
