{
  "graphVersion": "aura-graph/v2.0@680FD8D8F2142E92DE5A629B60D9C1DE160CCC57A0F7DDDDC872CDC4ACDAB9A8",
  "node": "G04",
  "lane": "governance",
  "stage": "decision-change-ledger",
  "job": "Replace the stale founder-decision registry with an append-only, source-bound, scope-explicit, supersession-aware ledger whose approved Graph v2 seed is immutable and whose validator fails closed on malformed, unreviewed, or silently rewritten authority.",
  "inputs": [
    {
      "name": "G01-verified-canonical-graph-registry",
      "version": "b81553a",
      "hash": "git:b81553a"
    },
    {
      "name": "approved-graph-v2-founder-decisions",
      "version": "2.0",
      "hash": "git:f7616886f9f8a171c847ef5eb49e932246ff989b"
    },
    {
      "name": "legacy-founder-decision-registry",
      "version": "FounderDecisionRegistryV1",
      "hash": "path:docs/plans/registry/decisions.json"
    }
  ],
  "outputs": [
    {
      "name": "founder-decision-ledger",
      "acceptanceSchema": "FounderDecisionRegistryV2",
      "path": "docs/plans/registry/decisions.json"
    },
    {
      "name": "decision-ledger-validator",
      "acceptanceSchema": "Fail-closed append-and-supersession proof",
      "path": "app/scripts/founder-decision-ledger.mjs"
    }
  ],
  "depends": ["G01:verified"],
  "reject": [
    "G01 is not independently verified",
    "an existing approved or inherited decision can be removed, reordered, or rewritten",
    "a decision lacks a real date, explicit scope, authority class, and reopenable source reference",
    "a conversational summary, agent inference, plan row, or unapproved proposal is treated as founder authority",
    "a superseded decision is overwritten instead of preserved and linked from a later entry",
    "a supersession target is missing, forward-referenced, duplicated, or cyclic",
    "unknown keys, accessors, hostile reflection, malformed runtime input, or non-canonical values pass or leak private exceptions",
    "the ledger edits the approved Graph v2 artifact or approval record in place",
    "the implementation performs a network, provider, payment, deployment, persistence, or other external action",
    "a website visual, 3D, rendering, animation, engine, scene, model, texture, shader, camera, lighting, motion, or quality-tier path changes"
  ],
  "writeSet": [
    "docs/plans/execution/v2/G04-decision-change-ledger.json",
    "docs/plans/registry/decisions.json",
    "docs/plans/registry/founder-decision.schema.json",
    "app/scripts/founder-decision-ledger.mjs",
    "app/scripts/founder-decision-ledger.test.mjs",
    "app/package.json"
  ],
  "freezeClass": "none",
  "owner": "primary-agent",
  "verifier": "independent-fresh-context",
  "sideEffects": "local",
  "externalGates": [],
  "verification": [
    "node --test scripts/founder-decision-ledger.test.mjs",
    "node scripts/founder-decision-ledger.mjs",
    "npm run typecheck",
    "npm run test:graph-v2",
    "fixture: the approved Graph v2 founder-decision seed is byte-for-byte pinned by canonical entry hashes",
    "fixture: later decisions append and supersede by backward identifier without mutating prior entries",
    "fixture: missing scope/source/authority/date, unknown keys, invalid dates, duplicates, forward references, and cycles fail closed",
    "fixture: getters, revoked proxies, and malformed shapes return bounded errors without invoking hidden values",
    "git diff --name-only <G04-base>...HEAD"
  ],
  "repair": {
    "maxLoops": 1,
    "boundary": "G04 writeSet only"
  },
  "evidence": {
    "startedFrom": "b05422675821984ca3625e4e6ff7c8e8ff5a32e2",
    "dependencyGate": "G01 independently verified; Graph v2 authority gate 14/14 and repository clean at preflight",
    "writeOwnership": "No ready, active, or verification-pending manifest owns any G04 path; blocked HM01, IP02, and UX03 do not carry write ownership.",
    "existingSurfaceAudit": "FounderDecisionRegistryV1 contains nine historical records but omits the approved Graph v2 FD20-01 through FD20-20 decisions, has no exact scope or authority-source contract, and encodes supersession in mutable free text.",
    "readyManifestCommit": "1760d3c60c3d8aba944dc8157b325547f39e7c6a",
    "activationCommit": "03b0ed4dc397507aa9546b4d97a25c9f46fe2bc5",
    "initialVerification": {
      "verdict": "fail",
      "closureCommit": "f3b464e3d8de8f48a5591beea12138cea273a2c1",
      "blockers": [
        "a fully recomputed chain could rewrite an earlier decision because self-consistent hashes did not prove an append-only transition from the prior committed ledger",
        "founder source records did not bind scope, dates, supersession, or the canonical substantive payload and accepted permissive substring author identities",
        "two later records could supersede the same target, syntactically valid nonexistent graph nodes were accepted, and decision chronology was not bound to the source commit"
      ]
    },
    "candidateCommit": "da27335fb39d23d64bfe65494770d48000ea97f4",
    "authorityBoundary": "The exact approved Graph v2 artifact is the immutable seed. The prior V1 registry remains reopenable by stored-blob and Git-object SHA at b054226, and appended change records remain recorded-pending-graph until a separately approved successor graph changes authority.",
    "writeSetCheck": {
      "declared": 6,
      "changed": 6,
      "delta": 0,
      "candidateGuardErrors": []
    },
    "gateReceipts": {
      "decisionLedger": "10/10 passed; CLI authority seed and committed-history transition pass; zero appended changes; errors []",
      "typecheck": "passed at repaired candidate da27335fb39d23d64bfe65494770d48000ea97f4",
      "graphV2": "24/24 passed across ten decision-ledger proofs and fourteen graph/freeze proofs; Graph v2 authority pass",
      "hostileRuntime": "revoked proxies, accessors, unknown keys, duplicate scope, malformed dates, invalid authority source shapes, broken hashes, broken chains, duplicate ids, forward supersession, recomputed history rewrites, duplicate global supersession, and invented graph nodes all fail closed with bounded errors",
      "repositorySources": "CLI requires every future source commit to be an ancestor, exactly Matt-Aurora-Ventures <lucidbloks@gmail.com>, reopenable at its declared repository approval path, chronologically compatible, and to contain exact decision/founder/state/body/canonical-payload-digest markers",
      "transitionProof": "the repository gate reopens the prior committed registry; a V1-to-V2 migration must match the pinned historical stored/object hashes and start with zero changes, while every V2-to-V2 transition requires the prior canonical change list as an exact prefix"
    },
    "protectedPathChanges": 0,
    "repairLoop": {
      "used": 1,
      "maximum": 1,
      "initialClosureCommit": "f3b464e3d8de8f48a5591beea12138cea273a2c1",
      "repairCommit": "da27335fb39d23d64bfe65494770d48000ea97f4"
    },
    "finalVerification": {
      "verdict": "fail",
      "closureCommit": "435db6fbacf6be43afcf09d539f6d61d933e5ebd",
      "passing": "Authority/G01, linear candidate lineage, exact 6/6 write set, manifest-only closure, zero protected paths, repository cleanliness, 10/10 focused decision-ledger tests, 24/24 Graph v2 tests, typecheck, individual transition rewrite rejection, source-payload binding, exact founder identity, global supersession uniqueness, approved node membership, chronology, and the current V1-to-V2 migration all passed.",
      "blockers": [
        "the repository transition gate opens only the newest registry-changing commit and its immediate predecessor, so a rewritten ledger can be buried in commit N and followed by an append in commit N+1; the final pair is self-consistent and the earlier accepted ledger is never compared to N"
      ],
      "requiredFutureAuthority": "A future explicitly authorized correction must traverse every commit that changes decisions.json from the pinned V1 anchor and prove the canonical prior changes are an exact prefix at every V2 transition before G04 can be re-entered."
    }
  },
  "status": "blocked"
}
